{
  "schemaVersion": 1,
  "receiptId": "9db70f5c9d2ec5e8a4cf5fd6b9beb745b484678607a7a20c13aaded2aadd58d5",
  "evidenceId": "pr511-legacy-baseline-scorecard",
  "kind": "REVIEWER_JUDGMENT",
  "subject": "BASELINE",
  "subjectIdentityRef": "402cd8a19ad6d5edad15dc214e1170a05531580ff3cf7d3bdbba196bcedf008b",
  "profileDigest": "d50f18ebc7a6866dcdf8fcc268608cb4c89c0873b2343ba87d1e07a80b4497d6",
  "producer": {
    "id": "legacy-scorecard-migration",
    "version": "legacy-unverified",
    "digest": "2b99b7cc18e4f12589aa7f7e44c027ffedde2383f4e27ff8346a521b42b8ec92"
  },
  "execution": {
    "kind": "AUTOMATED_CHECK",
    "adapter": "MANUAL_INSPECTION",
    "entrypoint": null,
    "arguments": [],
    "officialIngress": false
  },
  "status": "PASS",
  "summary": "Migrated baseline half of the historical five-dimension documentation scorecard; the candidate-contained migration is unverified.",
  "claims": {
    "gateOutcomes": [],
    "scoreAttestations": [],
    "searchDiscovery": null,
    "independentReview": null,
    "findingApprovals": []
  },
  "artifacts": [
    {
      "id": "legacy-baseline-scorecard",
      "kind": "JSON",
      "repositoryPath": "tools/completed-work-review/fixtures/pr-511/legacy-scorecard.json",
      "sha256": "2b99b7cc18e4f12589aa7f7e44c027ffedde2383f4e27ff8346a521b42b8ec92",
      "sizeBytes": 793
    }
  ],
  "observations": [
    { "id": "baseline-overall", "label": "Displayed baseline Overall", "value": 5.4, "unit": "score" }
  ],
  "createdAt": "2026-08-17T12:00:00.000Z"
}
